{
  "schema": "mai-tabs-export-v1",
  "exported_at": "2026-10-18T04:00:00Z",
  "browser": {
    "name": "chrome",
    "version": "130.0.1"
  },
  "urls_sanitized": true,
  "counts": {
    "windows": 1,
    "tabs": 1,
    "groups": 0
  },
  "windows": [
    {
      "id": 1,
      "focused": true,
      "tabs": [
        {
          "id": 1,
          "index": 0,
          "title": "Example",
          "url": "https://example.com/",
          "pinned": false,
          "audible": false,
          "discarded": false,
          "group_id": null,
          "last_accessed_ms": 1792296000000
        }
      ]
    }
  ],
  "groups": []
}
